"2-pixel perimeter around the header space.","2-pixel các vành đai xung quanh khoảng trống tiêu đề."
"Shortcut","Phím tắt"
"Shortcut Buttons Flavor","Nút tắt yêu thích"
"Sidebar (right)","Thanh trượt (bên phải)"
"Sign a billing agreement to streamline further purchases with PayPal.","Đăng ký một thỏa thuận thanh toán để hợp lí hóa những thanh toán về sau với PayPal."
"Size","Kích cỡ"
"Skip Order Review Step","Bỏ qua bước xem lại đơn hàng"
"Sort Order","Thứ tự sắp xếp"
"Specifies what the Authorization Honor Period is on the merchant’s PayPal account. It must mirror the setting in PayPal.","Xác định khoảng thời gian ủy quyền danh dự là trên các thương gia tài khoản PayPal. Nó phải được thiết lập trong PayPal."
"Specifies what the Order Valid Period is on the merchant’s PayPal account. It must mirror the setting in PayPal.","Xác định khoảng thời gian hợp lệ cho các tài khoản thương gia PayPal. Nó phải được thiết lập trong PayPal."
"State/Province","Bang/tỉnh"
"Static","Tĩnh"
"Street Address","Địa chỉ đường"
"Submitting order information...","Gửi thông tin đặt hàng..."
"Subscription ID","Đăng ký ID"
"Subscription Payment, either payment sent or payment received","Đăng ký thanh toán, thanh toán được gửi hoặc các khoản thanh toán đã nhận được"
"Subtotal","Tổng phụ"
"Test Mode","Chế độ dùng thử"
"The default number of child authorizations in your PayPal account is 1. To do multiple authorizations please contact PayPal to request an increase.","Số lượng ủy quyền con trong tài khoản PayPal của bạn mặc định là 1. Để có nhiều ủy quyền xin vui lòng liên hệ với PayPal để yêu cầu tăng."
"The maximum number of child authorizations is reached.","Số lượng ủy quyền tối đa là đạt."
"The merchant account is not yet verified.","Tài khoản Thương gia chưa được xác nhận."
"The payment is authorized but not settled.","Các khoản thanh toán được ủy quyền nhưng không giải quyết."
"The payment is pending because it was made to an email address that is not yet registered or confirmed.","Các khoản thanh toán đang chờ xử lý vì nó đã được thực hiện bởi địa chỉ email chưa được đăng ký hoặc xác nhận."
"The payment is pending while it is being reviewed by PayPal for risk.","Các khoản thanh toán đang chờ xử lý trong khi nó đang được xem xét bởi PayPal nếu có nguy cơ bị lỗi."
"The payment was made via credit card. In order to receive funds merchant must upgrade account to Business or Premier status.","Các khoản thanh toán được thực hiện thông qua thẻ tín dụng. Để nhận được tiền thương gia phải nâng cấp tài khoản đến trạng thái doanh nghiệp hoặc Cấp cao."
"This feature needs be enabled first for the merchant account through PayPal technical support.","Tính năng này cần được kích hoạt lần đầu tiên cho tài khoản thương gia thông qua PayPal hỗ trợ kỹ thuật."
"Time of Day","Thời gian trong ngày"
"Title","Tiêu đề"
"Transaction ID","ID giao dịch"
"Transaction Information","Thông tin giao dịch"
"Transaction reversal by PayPal administrators.","đảo ngược Giao dịch bởi người quản trị PayPal."
"Transaction reversal due to fraud detected by PayPal administrators.","đảo ngược Giao dịch do gian lận được phát hiện bởi người quản trị PayPal."
"Transfer Cart Line Items","Chuyển sang hàng Giỏ hàng"
"Transfer Shipping Options","Tùy chọn vận chuyển"
"Triggered Fraud Filters","Bộ lọc lừa đảo được kích hoạt"
"URL method for Cancel URL and Return URL","Phương pháp hủy URL và hoàn tác URL"
"Unknown reason. Please contact PayPal customer service.","Lý do không rõ. Xin vui lòng liên hệ với dịch vụ khách hàng của PayPal."
"Use Proxy","Sử dụng Proxy"
"Use colon to specify port. For example: ""test.example.com:5224"".","Sử dụng colon để chỉ rõ cổng. Ví dụ: ""test.example.com:5224""."
"User","Người Dùng"
"User-initiated Currency Conversion","Chuyển đổi tiền tệ bắt đầu sử dụng"
"VAT Number","Số VAT"
"Vendor","Nhà cung cấp"
"View","Hiển thị"
"View Demo","Xem Demo"
"View Transaction","Xem giao dịch"
"View Transaction Details","Xem chi tiết giao dịch"
"Virtual PayPal Debit Card Transaction","Giao dịch qua thẻ PayPal ghi nợ ảo"
"Virtual Terminal Payment","Thanh toán giai đoạn cuối Ảo"
"Void","Khoảng trống"
"We prefer PayPal (150 X 40)","Chúng tôi thích PayPal (150 X 40)"
"We prefer PayPal (150 X 60)","Chúng tôi thích PayPal (150 X 60)"
"Website Payments Pro Hosted Solution","Trang web thanh toán giải pháp lưu trữ chuyên nghiệp"
"Website Payments Pro Hosted Solution and Express Checkout","Trang web thanh toán giải pháp lưu trữ Pro và thanh toán Express"
"What is PayPal?","PayPal là gì?"
"Whether to create a billing agreement, if there are no active billing agreements available.","Dùng để để tạo ra một thỏa thuận thanh toán, nếu không có không có thỏa thuận thanh toán hoạt động có sẵn."
"WorldLink Withdrawal","Liên kết quốc tế rút tiền"
"Would you like to sign a billing agreement to streamline further purchases with PayPal?","Bạn có muốn ký một thỏa thuận thanh toán để tiếp tục mua hàng với PayPal?"
"Yes","Có"
"Yes (PayPal recommends this option)","Có (PayPal khuyến cáo tùy chọn này)"
"You will be redirected to the PayPal website when you place an order.","Bạn sẽ được chuyển hướng đến trang web PayPal khi bạn đặt một đơn đặt hàng."
"You will be redirected to the PayPal website.","Bạn sẽ được chuyển hướng đến trang web PayPal."
"You will be required to enter your payment details after you place an order.","Bạn sẽ được yêu cầu nhập thông tin thanh toán của bạn sau khi bạn đặt một đơn đặt hàng."
"Zip/Postal Code","Mã bưu chính"
"eBay Auction Payment","eBay bán đấu giá thanh toán"