"2-pixel perimeter around the header space.","Perímetro de 2 píxeles alrededor del espacio de cabera."
"The maximum number of child authorizations is reached.","Se ha alcanzado el número máximo de autorizaciones infantiles."
"The merchant account is not yet verified.","Todavía no se ha verificado la cuenta de vendedor."
"The payment is authorized but not settled.","El pago se ha autorizado, pero no se ha realizado."
"The payment is pending because it was made to an email address that is not yet registered or confirmed.","El pago está pendiente porque se ha realizado a una dirección de mail que todavía no se ha registrado o confirmado."
"The payment is pending while it is being reviewed by PayPal for risk.","El pago está pendiente, PayPal lo está revisando para asegurarse."
"The payment was made via credit card. In order to receive funds merchant must upgrade account to Business or Premier status.","El pago se ha realizado mediante tarjeta de crédito. Para recibir los fondos el vendedor tiene que actualizar la cuenta a estado Business o Premier."
"There was an error processing your order. Please contact us or try again later.","Hubo un error al procesar su pedido. Por favor contáctenos o intente mas tarde."
"This feature needs be enabled first for the merchant account through PayPal technical support.","Esta característica necesita primero ser activada para la cuenta comercial a través del soporte técnico de PayPal."
"Time of Day","Hora del día"
"Title","Título"
"Transaction ID","Id de la transacción"
"Transaction Information","Información de Transacción"
"Transaction reversal by PayPal administrators.","Revocación de la transacción por parte de los administradores de PayPal."
"Transaction reversal due to fraud detected by PayPal administrators.","Los administradores de PayPal han revocado la transacción a causa de la detección de fraude."
"Transfer Cart Line Items","Transferir la línea de los artículos en el carrito"
"Transfer Shipping Options","Transferir las opciones de envío"
"Triggered Fraud Filters","Filtros de Fraude Desencadenados"
"URL method for Cancel URL and Return URL","Método de URL para URL de cancelación y URL de retorno"
"Unknown reason. Please contact PayPal customer service.","Razones desconocidas. Por favor, contacte el servicio de atención al cliente de PayPal."
"Update Shipping Method","Actualizar Método de envío"
"Use Proxy","Utilizar Proxy"
"Use colon to specify port. For example: ""test.example.com:5224"".","Utilice dos puntos para especificar el puerto. Por ejemplo: ""prueba.ejemplo.com:5224""."
"User","Usuario"
"User-initiated Currency Conversion","Conversión de moneda iniciada por el usuario"
"VAT Number","Número de IVA"
"Vendor","Vendedor"
"View","Ver"
"View Demo","Vea la demostración"
"View Transaction","Ver transacción"
"View Transaction Details","Ver detalles de la transacción"
"Virtual PayPal Debit Card Transaction","Transacción de tarjeta de débito de PayPal virtual"
"Virtual Terminal Payment","Pago Terminal virtual"
"Void","Nulo"
"We prefer PayPal (150 X 40)","Preferimos PayPal (150 X 40)"
"We prefer PayPal (150 X 60)","Preferimos PayPal (150 X 60)"
"Website Payments Pro Hosted Solution","Solución Hospedada de Pagos Web Pro"
"Website Payments Pro Hosted Solution and Express Checkout","Solución alojada de Website Payments Pro y Pago exprés"
"Website Payments Standard","Sitio Web de Pagos Estándar"
"What is PayPal?","¿Qué es PayPal?"
"Whether to create a billing agreement, if there are no active billing agreements available.","Opción de creación de un contrato de facturación, si no hay contratos de facturación activos disponibles."
"WorldLink Withdrawal","Retirada de Fondos WorldLink"
"Would you like to sign a billing agreement to streamline further purchases with PayPal?","¿Le gustaría firmar un contrato de facturación para agilizar sus futuras compras con PayPal?"
"Yes","Sí"
"Yes (PayPal recommends this option)","Sí (PayPal recomienda esta opción)"
"You will be redirected to the PayPal website when you place an order.","Cuando realice el pedido se le devolverá a la página PayPal."
"You will be redirected to the PayPal website.","Se le redirigirá al sitio web de PayPal."
"You will be required to enter your payment details after you place an order.","Se le solicitará que introduzca los detalles del pago tras realizar el pedido."
"Zip/Postal Code","Código Postal"
"eBay Auction Payment","Pago de subasta de eBay"